{
  "basis": {
    "boundaryPolicy": "compact-support-inside-valid-cell-union",
    "centers": [
      {
        "id": "basis-0-0",
        "point": {
          "x": 4,
          "y": -1
        }
      },
      {
        "id": "basis-0-1",
        "point": {
          "x": 4,
          "y": 0
        }
      },
      {
        "id": "basis-0-2",
        "point": {
          "x": 4,
          "y": 1
        }
      },
      {
        "id": "basis-1-0",
        "point": {
          "x": 6,
          "y": -1
        }
      },
      {
        "id": "basis-1-1",
        "point": {
          "x": 6,
          "y": 0
        }
      },
      {
        "id": "basis-1-2",
        "point": {
          "x": 6,
          "y": 1
        }
      },
      {
        "id": "basis-2-0",
        "point": {
          "x": 8,
          "y": -1
        }
      },
      {
        "id": "basis-2-1",
        "point": {
          "x": 8,
          "y": 0
        }
      },
      {
        "id": "basis-2-2",
        "point": {
          "x": 8,
          "y": 1
        }
      },
      {
        "id": "basis-3-0",
        "point": {
          "x": 10,
          "y": -1
        }
      },
      {
        "id": "basis-3-1",
        "point": {
          "x": 10,
          "y": 0
        }
      },
      {
        "id": "basis-3-2",
        "point": {
          "x": 10,
          "y": 1
        }
      },
      {
        "id": "basis-4-0",
        "point": {
          "x": 12,
          "y": -1
        }
      },
      {
        "id": "basis-4-1",
        "point": {
          "x": 12,
          "y": 0
        }
      },
      {
        "id": "basis-4-2",
        "point": {
          "x": 12,
          "y": 1
        }
      },
      {
        "id": "basis-5-0",
        "point": {
          "x": 14,
          "y": -1
        }
      },
      {
        "id": "basis-5-1",
        "point": {
          "x": 14,
          "y": 0
        }
      },
      {
        "id": "basis-5-2",
        "point": {
          "x": 14,
          "y": 1
        }
      },
      {
        "id": "basis-6-0",
        "point": {
          "x": 16,
          "y": -1
        }
      },
      {
        "id": "basis-6-1",
        "point": {
          "x": 16,
          "y": 0
        }
      },
      {
        "id": "basis-6-2",
        "point": {
          "x": 16,
          "y": 1
        }
      },
      {
        "id": "basis-7-0",
        "point": {
          "x": 18,
          "y": -1
        }
      },
      {
        "id": "basis-7-1",
        "point": {
          "x": 18,
          "y": 0
        }
      },
      {
        "id": "basis-7-2",
        "point": {
          "x": 18,
          "y": 1
        }
      },
      {
        "id": "basis-8-0",
        "point": {
          "x": 20,
          "y": -1
        }
      },
      {
        "id": "basis-8-1",
        "point": {
          "x": 20,
          "y": 0
        }
      },
      {
        "id": "basis-8-2",
        "point": {
          "x": 20,
          "y": 1
        }
      }
    ],
    "coefficientUnit": "mm/s",
    "degree": 3,
    "family": "tensor-cardinal-cubic-streamfunction-v1",
    "interiorMarginCells": 1,
    "quadratureOrder": 4,
    "spacingX": 1,
    "spacingY": 1,
    "streamfunctionLengthScale": 1
  },
  "budgets": {
    "velocityGradientRms": {
      "unit": "1/s",
      "value": 0.8
    },
    "velocityRms": {
      "unit": "mm/s",
      "value": 0.5
    }
  },
  "description": "A generated two-dimensional artery-like vector field and simulated point sensors used to quantify finite-basis perturbations compatible with declared observations and budgets.",
  "domain": {
    "coordinateFrameId": "generated-artery-cartesian",
    "id": "generated-artery-like-domain-v1",
    "lengthUnit": "mm",
    "validCellMask": [
      false,
      false,
      false,
      false,
      false,
      false,
      false,
      false,
      false,
      false,
      false,
      false,
      false,
      false,
      false,
      false,
      false,
      false,
      false,
      false,
      false,
      false,
      false,
      false,
      false,
      false,
      false,
      false,
      false,
      false,
      false,
      false,
      false,
      false,
      false,
      false,
      false,
      false,
      false,
      false,
      false,
      false,
      false,
      false,
      false,
      false,
      false,
      false,
      true,
      true,
      true,
      true,
      true,
      true,
      true,
      true,
      true,
      true,
      false,
      false,
      false,
      false,
      true,
      true,
      true,
      true,
      true,
      true,
      true,
      true,
      true,
      true,
      true,
      true,
      true,
      true,
      true,
      true,
      true,
      true,
      true,
      true,
      true,
      true,
      true,
      true,
      true,
      true,
      true,
      true,
      true,
      true,
      true,
      true,
      true,
      true,
      true,
      true,
      true,
      true,
      true,
      true,
      true,
      true,
      true,
      true,
      true,
      true,
      true,
      true,
      true,
      true,
      true,
      true,
      true,
      true,
      true,
      true,
      true,
      true,
      true,
      true,
      true,
      true,
      true,
      true,
      true,
      true,
      true,
      true,
      true,
      true,
      true,
      true,
      true,
      true,
      true,
      true,
      true,
      true,
      true,
      true,
      true,
      true,
      true,
      true,
      true,
      true,
      true,
      true,
      true,
      true,
      true,
      true,
      true,
      true,
      true,
      true,
      true,
      true,
      true,
      true,
      true,
      true,
      true,
      true,
      true,
      true,
      true,
      true,
      true,
      true,
      true,
      true,
      true,
      true,
      true,
      true,
      true,
      true,
      true,
      true,
      true,
      true,
      true,
      true,
      true,
      true,
      true,
      true,
      true,
      true,
      true,
      true,
      true,
      true,
      true,
      true,
      true,
      true,
      true,
      true,
      true,
      true,
      true,
      true,
      true,
      true,
      true,
      true,
      true,
      true,
      true,
      true,
      true,
      true,
      true,
      true,
      true,
      true,
      true,
      true,
      true,
      true,
      true,
      true,
      false,
      false,
      false,
      false,
      true,
      true,
      true,
      true,
      true,
      true,
      true,
      true,
      true,
      true,
      false,
      false,
      false,
      false,
      false,
      false,
      false,
      false,
      false,
      false,
      false,
      false,
      false,
      false,
      false,
      false,
      false,
      false,
      false,
      false,
      false,
      false,
      false,
      false,
      false,
      false,
      false,
      false,
      false,
      false,
      false,
      false,
      false,
      false,
      false,
      false,
      false,
      false,
      false,
      false,
      false,
      false,
      false,
      false,
      false,
      false,
      false,
      false
    ],
    "xEdges": [
      0,
      1,
      2,
      3,
      4,
      5,
      6,
      7,
      8,
      9,
      10,
      11,
      12,
      13,
      14,
      15,
      16,
      17,
      18,
      19,
      20,
      21,
      22,
      23,
      24
    ],
    "yEdges": [
      -6,
      -5,
      -4,
      -3,
      -2,
      -1,
      0,
      1,
      2,
      3,
      4,
      5,
      6
    ]
  },
  "id": "ghf-en-e05-r08-intersensor-x-component",
  "limitations": [
    "The baseline, sensors, tolerances, and budgets are generated demonstration choices, not patient measurements.",
    "The perturbation is kinematically divergence-free in the declared basis but is not asserted to satisfy momentum, forcing, or unknown initial and boundary conditions.",
    "Optimization results apply only to the retained finite basis, declared valid-cell union, observation model, budgets, target, directional sweep, and numerical tolerances."
  ],
  "numerics": {
    "basisConditionLimit": 1000000000,
    "maximumSolverIterations": 300,
    "rankRelativeTolerance": 1e-10,
    "verificationAbsoluteTolerance": 2e-7,
    "verificationRelativeTolerance": 2e-7
  },
  "observations": [
    {
      "baselineValue": 10.924059771791981,
      "component": "x",
      "coordinateFrameId": "generated-artery-cartesian",
      "id": "sensor-1-x",
      "observedValue": 10.924059771791981,
      "point": {
        "x": 4.5,
        "y": -1.5
      },
      "provenance": "Generated vector sensor with an exact-zero perturbation residual for the finite-basis demonstration.",
      "sensorId": "sensor-1",
      "tolerance": 0,
      "type": "point-component",
      "unit": "mm/s"
    },
    {
      "baselineValue": 0.01265890280602041,
      "component": "y",
      "coordinateFrameId": "generated-artery-cartesian",
      "id": "sensor-1-y",
      "observedValue": 0.01265890280602041,
      "point": {
        "x": 4.5,
        "y": -1.5
      },
      "provenance": "Generated vector sensor with an exact-zero perturbation residual for the finite-basis demonstration.",
      "sensorId": "sensor-1",
      "tolerance": 0,
      "type": "point-component",
      "unit": "mm/s"
    },
    {
      "baselineValue": 12.04998891239481,
      "component": "x",
      "coordinateFrameId": "generated-artery-cartesian",
      "id": "sensor-2-x",
      "observedValue": 12.04998891239481,
      "point": {
        "x": 9.5,
        "y": 1.5
      },
      "provenance": "Generated vector sensor with an exact-zero perturbation residual for the finite-basis demonstration.",
      "sensorId": "sensor-2",
      "tolerance": 0,